<?xml version="1.0" encoding="UTF-8"?>
<note xmlns="http://www.mysoft.com" 
	xmlns:xsi="http://www.w3.org/2001/XMLSchema-instance"
	xsi:schemaLocation="http://www.mysoft.com note.xsd">

	<to>Alan</to>
	<from>Steven</from>
	<heading>Test heading</heading>
	<body>BODY</body>
	<card lock="YES">
		<number>622202192837412439</number>
		<amount>1000</amount>
	</card>
	<card lock="NO">
		<number>622202192837412439</number>
		<amount>1</amount>
	</card>
	<card lock="NO">
		<number>644202192837412439</number>
		<amount>200</amount>
	</card>
	<age>98</age>
	<band>Dell</band>
	<letter>f</letter>
	<onemoreLetter>wee</onemoreLetter>
	<uperLetter>GUK</uperLetter>
	<three_number>123</three_number>
	<either>male</either>
	<eight_letter>qqqqqqqq</eight_letter>
	<fix_length>hello</fix_length>
	<range_length>we</range_length>
</note>
